{
  "project": "Trial: Vanilla JS Calculator",
  "context_version": 9,
  "created": "2026-04-11T23:00:00Z",
  "last_updated": "2026-04-12T01:43:38Z",
  "updated_by": "person_a",
  "updated_from_commit": "387f419d9389d02f7306388bc2eed55c7008199c",
  "tasks": [
    {
      "id": "task-01",
      "path": "state/tasks/task-01.json",
      "mode": "compete",
      "status": "in_progress"
    }
  ],
  "decisions": [
    {
      "text": "Pure HTML/CSS/vanilla JS, no build tools",
      "scope": "global"
    },
    {
      "text": "All state changes via orchestrator commands, never hand-edited",
      "scope": "global"
    }
  ],
  "open_questions": [],
  "recent_changes": [
    {
      "timestamp": "2026-04-12T00:38:26Z",
      "author": "orchestrator-init",
      "summary": "Initialized trial calculator project: 3 tasks (split, compete, collab), placeholder files created"
    },
    {
      "timestamp": "2026-04-12T00:41:13Z",
      "author": "orchestrator-init",
      "summary": "Updated acceptance checks: unary minus (task-01), flexible viewport (task-02), error handling (task-03)"
    },
    {
      "timestamp": "2026-04-12T00:48:10Z",
      "author": "person_a",
      "summary": "task-01 done: calculator engine merged to main, all 6 acceptance checks pass"
    },
    {
      "timestamp": "2026-04-12T00:56:15Z",
      "author": "person_a",
      "summary": "Simplified trial to single compete task: all 3 build complete calculators independently"
    },
    {
      "timestamp": "2026-04-12T01:05:46Z",
      "author": "person_a",
      "summary": "Removed compare-compete-task command and all heuristic scoring helpers; simplified to human review via set-winner only"
    },
    {
      "timestamp": "2026-04-12T01:09:16Z",
      "author": "person_a",
      "summary": "Collapsed README to pure signpost, removed duplication with onboarding"
    },
    {
      "timestamp": "2026-04-12T01:19:17Z",
      "author": "person_a",
      "summary": "Recorded submission for task-01 by person_a on feat/task-01-a"
    },
    {
      "timestamp": "2026-04-12T01:43:38Z",
      "author": "person_a",
      "summary": "Bug fix: record-submission no longer auto-flips task status to submitted (caused premature 'submitted' state during trial)"
    }
  ]
}
